{
  "name": "odor_demo",
  "description": "MuJoCo odor-array demo profile",
  "modelPath": "onnx_runtime/example/policy.onnx",
  "standingPose": [-0.1, -0.8, 1.8, 0.1, 0.8, -1.8, 0.1, 0.8, -1.8, -0.1, -0.8, 1.8, 0.0, 0.0, 0.0, 0.0],
  "sittingPose": [0.0, 0.0, 0.0, 0.0, 0.0, 0.0, 0.0, 0.0, 0.0, 0.0, 0.0, 0.0, 0.0, 0.0, 0.0, 0.0],
  "standUpCounts": 150,
  "sitDownCounts": 150,
  "inferKp": [65.0, 95.0, 120.0, 65.0, 95.0, 120.0, 65.0, 95.0, 120.0, 65.0, 95.0, 120.0, 0.0, 0.0, 0.0, 0.0],
  "inferKd": [20.0, 20.0, 20.0, 20.0, 20.0, 20.0, 20.0, 20.0, 20.0, 20.0, 20.0, 20.0, 1.0, 1.0, 1.0, 1.0],
  "standUpKp": [200.0, 200.0, 200.0, 200.0, 200.0, 200.0, 200.0, 200.0, 200.0, 200.0, 200.0, 200.0, 200.0, 200.0, 200.0, 200.0],
  "standUpKd": [8.0, 8.0, 8.0, 8.0, 8.0, 8.0, 8.0, 8.0, 8.0, 8.0, 8.0, 8.0, 8.0, 8.0, 8.0, 8.0],
  "sitDownKp": [200.0, 200.0, 200.0, 200.0, 200.0, 200.0, 200.0, 200.0, 200.0, 200.0, 200.0, 200.0, 200.0, 200.0, 200.0, 200.0],
  "sitDownKd": [8.0, 8.0, 8.0, 8.0, 8.0, 8.0, 8.0, 8.0, 8.0, 8.0, 8.0, 8.0, 8.0, 8.0, 8.0, 8.0],
  "imuGyroscopeScale": 0.25,
  "jointVelocityScale": [0.05, 0.05, 0.05, 0.05],
  "actionScale": [0.125, 0.25, 0.25, 5.0]
}
